|french|lingala
0|"Tout le plaisir que j’ai eu dans le berceau de maman
Dépasse celui des autres lits dans lesquels j’ai dormi 
Maman, si tu étais encore en vie, je t’aurais demandé de me faire revivre ces moments là 
Jamais tu ne supportais de me voir en pleurs et  toi souriante
Jamais tu ne supportais de me voir faire une insomnie et toi avoir sommeil 
Jamais tu ne supportais qu’un moustique me dérange
Quand je tombais malade, tu veillais jusqu’au matin 
Depuis que tu es parti, je me sens abandonnée, ta récompense à qui la remettrais-je ? 
Même quand je pleure, personne n’est là pour me dorloter, voila pourquoi je te chante cette chanson maman NIONDO"|"Bilengi mingi na sala na berceaux ya mama
Eleki elingi koleka ba mbeto nioso  nga na lala 
Mama soki ozalaki kaka na bomoyi , mbele na sengi  o zongisa nga susu wana 
Jamais olingaki nga na lela yo seka
Jamais olingaki yo lala nga na lamuka 
Jamais olingaki ata ngungi atoungisa nga 
Soki na beli ozalaki kotana tongo nsa 
Banda y’okenda nakoma abandonée, recompense nayo nako pesa nani yango 
Ata na leli nani ako dorloter nga ah, yango na yembeli yo zembo oyo mama NIONDO"
1|"La saveur du lait maternel de ma maman dépasse le goût de toutes les recettes des cordons bleus chez qui j’ai mangé 
Même s’il n’y avait pas d’huile ou de tomate,  cela avait plus de gout que la viande 
Depuis que tu es partie j’ai plus d’appétit, je ne mange que pour faire plaisir à ma bouche"|"Elengi ya libelé ya mama abota ngaï, eleki ba recette nioso ya ba cordon bleu  nga na lya 
Ata mafuta, tomate ezalaki te, kasi yango elakaki mosuni n’élengi 
Banda y’okenda appétit esila nga ah, nakoma ko lya kaka po na sepelisa monoko"
2|"Les conseils de ma maman étaient dépourvus de bulletins puis de droits d’inscription mais ils étaient plus précieux que les leçons que les maitres d’écoles et les professeurs m’ont données
Maman si tu étais encore en vie, j’aurais demandé à ce qu’on te nomme Ministre de l’Education 
Les parquets et toutes les prisons auraient fermé leurs portes 
Les personnes mal éduqué n’auraient même plus existé"|"Mateyas ya mama ezanga bulletin pe minerval, kasi eleki ba leçons ba maitres, ba professeurs ba pesa nga 
Mama soki ozalaki kaka na bomoyi
Mbelé na sengi batya yo ministre y’éducation 
Mbelé ba parquets, ba prison nioso bakanga 
Mbelé kutu motu mabé azali té eh"
3|"Aujourd’hui, j’ai beaucoup pensé à toi maman
Car le jour de mon anniversaire approche 
Les invités vont manger et boire 
Toi mon artisan, tu n’es pas là
Là où tu es, si tu trouve une occasion
Envoie-moi une carte de vœux, ou ne serait-ce une fleur 
Ma joie sera multipliée par deux 
Normalement la fête d’aujourd’hui est pour toi 
Comme le serment d’Hippocrate que font les médecins 
Moi mon serment est que tu sois toujours ma maman 
Même s’ils refont le monde dix fois 
Moi mon serment est que tu sois toujours ma maman"|"Lelo nakanisi yo mingi mama ah 
Mpo jour y’anniversaire na nga ekomi pene 
B’invités bako lya bako mela masanga 
Yo kutu artisan na nga y’ozali te 
Epayi y’ozali soki okutani n’occasion eh 
Tindela nga carte de voeux, ata fololo 
Esengo na nga ekozala multiplier fois deux 
Normalement fêti ya lelo ezali ya yo 
Serment d’Hippocrate ba médecins ba kosalaka 
Ya nga serment  y’ozala toujours mama nga
Ata ba bandeli mokili soki mbala zomi
Ya nga serment y’ozala toujours mama nga"
4|"Aujourd’hui, j’ai beaucoup pensé à toi maman
Car le jour de mon anniversaire approche 
Les invités vont manger et boire 
Toi mon artisan, tu n’es pas là
Là où tu es, si tu trouve une occasion
Envoie-moi une carte de vœux, ou ne serait-ce une fleur 
Ma joie sera multipliée par deux 
Normalement la fête d’aujourd’hui est pour toi 
Comme le serment d’Hippocrate que font les médecins 
Moi mon serment est que tu sois toujours ma maman 
Même s’ils refont le monde cinq cent fois 
Moi mon serment est que tu sois toujours ma maman
Maman, si tu étais encore en vie, je t’aurais demandé de me faire revivre ces moments là 
Maman, si tu étais encore en vie, je t’aurais demandé de me faire revivre ces moments là 
Je me console avec JOE NIONDO qui te ressemble beaucoup"|"Mais lelo nakanisi yo mingi mama ah NIONDO 
Mpo jour y’anniversaire na nga ekomi pene 
B’invités bako lya bako mela masanga 
Yo kutu artisan na nga y’ozali te 
Epayi y’ozali soki okutani n’occasion eh 
Tindela nga carte de voeux, ata fololo 
Esengo na nga ekozala multiplier fois deux 
Normalement fêti ya lelo ezali ya yo 
Serment d’Hippocrate ba médecins ba kosalaka 
Ya nga serment  y’ozala toujours mama nga
Ata ba bandeli mokili soki mbala kama eh 
Ya nga serment y’ozala toujours mama nga 
Mama soki ozalaki kaka na bomoyi , mbele na sengi  o zongisa nga susu wana 
Mama soki ozalaki kaka na bomoyi , mbele na sengi  o zongisa nga susu wana 
Consolation na ngaï JOE NIONDO photocopie na yo"
